{
  "schema_version": "template-first.1",
  "template_id": "coilmaster_terra_hwc_rh",
  "source_case_id": "TERRA-HWC-JOHN-2026-09-23-R",
  "supplier": "coilmaster",
  "coil_category": "HWC",
  "coil_hand": "RH",
  "header_type": "Header 1",
  "source_folder": "Case/feed/terra_hwc_rh",
  "intake_status": "seeded_review_required",
  "review_status": "review_required",
  "release_status": "review_aid_only",
  "export_allowed": false,
  "production_approved": false,
  "pdf_export_enabled": false,
  "source_files": [
    {
      "role": "ez_drawing_pdf",
      "filename": "TERRA_HWC_RH.pdf",
      "filename_policy": "not_committed",
      "page_count": 1,
      "committed_copy": false,
      "notes": "Vectorised to a slotted review template; raw PDF not copied."
    }
  ],
  "slot_evidence": [
    {
      "slot_id": "slot.BF",
      "value": "0.63",
      "source_channels": [
        "ez_drawing_pdf"
      ],
      "review_status": "review_required"
    },
    {
      "slot_id": "slot.CASING_MATERIAL",
      "value": "16 Ga.",
      "source_channels": [
        "ez_drawing_pdf"
      ],
      "review_status": "review_required"
    },
    {
      "slot_id": "slot.CASING_MATERIAL_2",
      "value": "Galvanized Steel",
      "source_channels": [
        "ez_drawing_pdf"
      ],
      "review_status": "review_required"
    },
    {
      "slot_id": "slot.CD",
      "value": "6.50",
      "source_channels": [
        "ez_drawing_pdf"
      ],
      "review_status": "review_required"
    },
    {
      "slot_id": "slot.CH",
      "value": "16.25",
      "source_channels": [
        "ez_drawing_pdf"
      ],
      "review_status": "review_required"
    },
    {
      "slot_id": "slot.CIRCUITING",
      "value": "5 Feed/ 6 Pass",
      "source_channels": [
        "ez_drawing_pdf"
      ],
      "review_status": "review_required"
    },
    {
      "slot_id": "slot.CL",
      "value": "25.50",
      "source_channels": [
        "ez_drawing_pdf"
      ],
      "review_status": "review_required"
    },
    {
      "slot_id": "slot.COIL_TUBE_FACE",
      "value": "Tube Face = 10",
      "source_channels": [
        "ez_drawing_pdf"
      ],
      "review_status": "review_required"
    },
    {
      "slot_id": "slot.DRY_WEIGHT",
      "value": "33.7 Lbs. Per Coil",
      "source_channels": [
        "ez_drawing_pdf"
      ],
      "review_status": "review_required"
    },
    {
      "slot_id": "slot.FASTENER_TYPE",
      "value": "Rivets",
      "source_channels": [
        "ez_drawing_pdf"
      ],
      "review_status": "review_required"
    },
    {
      "slot_id": "slot.FH",
      "value": "15",
      "source_channels": [
        "ez_drawing_pdf"
      ],
      "review_status": "review_required"
    },
    {
      "slot_id": "slot.FIN_MATERIAL",
      "value": "11 Fins Per Inch",
      "source_channels": [
        "ez_drawing_pdf"
      ],
      "review_status": "review_required"
    },
    {
      "slot_id": "slot.FIN_MATERIAL_2",
      "value": "0.0075 Aluminum",
      "source_channels": [
        "ez_drawing_pdf"
      ],
      "review_status": "review_required"
    },
    {
      "slot_id": "slot.FIN_MATERIAL_3",
      "value": "Flat",
      "source_channels": [
        "ez_drawing_pdf"
      ],
      "review_status": "review_required"
    },
    {
      "slot_id": "slot.FL",
      "value": "22.5",
      "source_channels": [
        "ez_drawing_pdf"
      ],
      "review_status": "review_required"
    },
    {
      "slot_id": "slot.HD2",
      "value": "4.00",
      "source_channels": [
        "ez_drawing_pdf"
      ],
      "review_status": "review_required"
    },
    {
      "slot_id": "slot.HEADER_MATERIAL",
      "value": "Type L Copper",
      "source_channels": [
        "ez_drawing_pdf"
      ],
      "review_status": "review_required"
    },
    {
      "slot_id": "slot.HF",
      "value": "1.50",
      "source_channels": [
        "ez_drawing_pdf"
      ],
      "review_status": "review_required"
    },
    {
      "slot_id": "slot.I1",
      "value": "2.75",
      "source_channels": [
        "ez_drawing_pdf"
      ],
      "review_status": "review_required"
    },
    {
      "slot_id": "slot.INTERNAL_VOLUME",
      "value": "1.17 Gal Per Coil",
      "source_channels": [
        "ez_drawing_pdf"
      ],
      "review_status": "review_required"
    },
    {
      "slot_id": "slot.MODEL_NUMBER",
      "value": "HW-A-F-03-11-15.00x22.50-R",
      "source_channels": [
        "ez_drawing_pdf"
      ],
      "review_status": "review_required"
    },
    {
      "slot_id": "slot.O2",
      "value": "13.50",
      "source_channels": [
        "ez_drawing_pdf"
      ],
      "review_status": "review_required"
    },
    {
      "slot_id": "slot.OAL",
      "value": "28.75",
      "source_channels": [
        "ez_drawing_pdf"
      ],
      "review_status": "review_required"
    },
    {
      "slot_id": "slot.R2",
      "value": "1.25",
      "source_channels": [
        "ez_drawing_pdf"
      ],
      "review_status": "review_required"
    },
    {
      "slot_id": "slot.RB",
      "value": "2.25",
      "source_channels": [
        "ez_drawing_pdf"
      ],
      "review_status": "review_required"
    },
    {
      "slot_id": "slot.RF",
      "value": "1.50",
      "source_channels": [
        "ez_drawing_pdf"
      ],
      "review_status": "review_required"
    },
    {
      "slot_id": "slot.ROWS",
      "value": "3.00",
      "source_channels": [
        "ez_drawing_pdf"
      ],
      "review_status": "review_required"
    },
    {
      "slot_id": "slot.S1",
      "value": "1.25",
      "source_channels": [
        "ez_drawing_pdf"
      ],
      "review_status": "review_required"
    },
    {
      "slot_id": "slot.SL2",
      "value": "10.00",
      "source_channels": [
        "ez_drawing_pdf"
      ],
      "review_status": "review_required"
    },
    {
      "slot_id": "slot.SUPPLY_CONN_SIZE",
      "value": "1.375\" OD Header",
      "source_channels": [
        "ez_drawing_pdf"
      ],
      "review_status": "review_required"
    },
    {
      "slot_id": "slot.SUPPLY_CONN_SIZE_2",
      "value": "1.25\" MPT-Copper",
      "source_channels": [
        "ez_drawing_pdf"
      ],
      "review_status": "review_required"
    },
    {
      "slot_id": "slot.TAG",
      "value": "PHWC-1",
      "source_channels": [
        "ez_drawing_pdf"
      ],
      "review_status": "review_required"
    },
    {
      "slot_id": "slot.TF",
      "value": "0.63",
      "source_channels": [
        "ez_drawing_pdf"
      ],
      "review_status": "review_required"
    },
    {
      "slot_id": "slot.TUBE_MATERIAL",
      "value": "0.625 x 0.020",
      "source_channels": [
        "ez_drawing_pdf"
      ],
      "review_status": "review_required"
    },
    {
      "slot_id": "slot.TUBE_MATERIAL_2",
      "value": "Copper Smooth",
      "source_channels": [
        "ez_drawing_pdf"
      ],
      "review_status": "review_required"
    }
  ],
  "observed_candidates": []
}