{
  "schema_version": "template-first.1",
  "template_id": "coilmaster_hgrh_rh_header4",
  "source_case_id": "FEED-HG_4_RH",
  "supplier": "coilmaster",
  "coil_category": "HGRH",
  "coil_hand": "RH",
  "header_type": "Header 4",
  "source_folder": "Case/feed/HG_4_RH",
  "intake_status": "seeded_review_required",
  "review_status": "review_required",
  "release_status": "review_aid_only",
  "export_allowed": false,
  "production_approved": false,
  "pdf_export_enabled": false,
  "source_files": [
    {
      "role": "ez_drawing_pdf",
      "filename": "HG_4_RH.pdf",
      "filename_policy": "not_committed",
      "page_count": 1,
      "committed_copy": false,
      "notes": "Vectorised to a slotted review template; raw PDF not copied."
    }
  ],
  "slot_evidence": [
    {
      "slot_id": "slot.BF",
      "value": "0.63",
      "source_channels": [
        "ez_drawing_pdf"
      ],
      "review_status": "review_required"
    },
    {
      "slot_id": "slot.CASING_MATERIAL",
      "value": "16 Ga.",
      "source_channels": [
        "ez_drawing_pdf"
      ],
      "review_status": "review_required"
    },
    {
      "slot_id": "slot.CASING_MATERIAL_2",
      "value": "Galvanized Steel",
      "source_channels": [
        "ez_drawing_pdf"
      ],
      "review_status": "review_required"
    },
    {
      "slot_id": "slot.CD",
      "value": "10.75",
      "source_channels": [
        "ez_drawing_pdf"
      ],
      "review_status": "review_required"
    },
    {
      "slot_id": "slot.CH",
      "value": "25.25",
      "source_channels": [
        "ez_drawing_pdf"
      ],
      "review_status": "review_required"
    },
    {
      "slot_id": "slot.CIRCUITING",
      "value": "6 Passes per Feed",
      "source_channels": [
        "ez_drawing_pdf"
      ],
      "review_status": "review_required"
    },
    {
      "slot_id": "slot.CIRCUITING_2",
      "value": "C1: 1 Feed C2: 1 Feed",
      "source_channels": [
        "ez_drawing_pdf"
      ],
      "review_status": "review_required"
    },
    {
      "slot_id": "slot.CIRCUITING_3",
      "value": "C3: 1 Feed C4: 1 Feed",
      "source_channels": [
        "ez_drawing_pdf"
      ],
      "review_status": "review_required"
    },
    {
      "slot_id": "slot.CL",
      "value": "63.00",
      "source_channels": [
        "ez_drawing_pdf"
      ],
      "review_status": "review_required"
    },
    {
      "slot_id": "slot.COIL_TUBE_FACE",
      "value": "Tube Face = 24",
      "source_channels": [
        "ez_drawing_pdf"
      ],
      "review_status": "review_required"
    },
    {
      "slot_id": "slot.DRY_WEIGHT",
      "value": "47.0 Lbs. Per Coil",
      "source_channels": [
        "ez_drawing_pdf"
      ],
      "review_status": "review_required"
    },
    {
      "slot_id": "slot.FASTENER_TYPE",
      "value": "Rivets",
      "source_channels": [
        "ez_drawing_pdf"
      ],
      "review_status": "review_required"
    },
    {
      "slot_id": "slot.FH",
      "value": "24",
      "source_channels": [
        "ez_drawing_pdf"
      ],
      "review_status": "review_required"
    },
    {
      "slot_id": "slot.FIN_MATERIAL",
      "value": "13 Fins Per Inch",
      "source_channels": [
        "ez_drawing_pdf"
      ],
      "review_status": "review_required"
    },
    {
      "slot_id": "slot.FIN_MATERIAL_2",
      "value": "0.0075 Aluminum",
      "source_channels": [
        "ez_drawing_pdf"
      ],
      "review_status": "review_required"
    },
    {
      "slot_id": "slot.FIN_MATERIAL_3",
      "value": "Flat",
      "source_channels": [
        "ez_drawing_pdf"
      ],
      "review_status": "review_required"
    },
    {
      "slot_id": "slot.FL",
      "value": "60",
      "source_channels": [
        "ez_drawing_pdf"
      ],
      "review_status": "review_required"
    },
    {
      "slot_id": "slot.HD2",
      "value": "3.50",
      "source_channels": [
        "ez_drawing_pdf"
      ],
      "review_status": "review_required"
    },
    {
      "slot_id": "slot.HEADER_MATERIAL",
      "value": "Type L Copper",
      "source_channels": [
        "ez_drawing_pdf"
      ],
      "review_status": "review_required"
    },
    {
      "slot_id": "slot.HF",
      "value": "1.50",
      "source_channels": [
        "ez_drawing_pdf"
      ],
      "review_status": "review_required"
    },
    {
      "slot_id": "slot.I1",
      "value": "2.00",
      "source_channels": [
        "ez_drawing_pdf"
      ],
      "review_status": "review_required"
    },
    {
      "slot_id": "slot.I3",
      "value": "9.00",
      "source_channels": [
        "ez_drawing_pdf"
      ],
      "review_status": "review_required"
    },
    {
      "slot_id": "slot.I5",
      "value": "15.00",
      "source_channels": [
        "ez_drawing_pdf"
      ],
      "review_status": "review_required"
    },
    {
      "slot_id": "slot.I7",
      "value": "21.00",
      "source_channels": [
        "ez_drawing_pdf"
      ],
      "review_status": "review_required"
    },
    {
      "slot_id": "slot.MODEL_NUMBER",
      "value": "CD-F-F-01-13-24.00x60.00-R",
      "source_channels": [
        "ez_drawing_pdf"
      ],
      "review_status": "review_required"
    },
    {
      "slot_id": "slot.O2",
      "value": "2.00",
      "source_channels": [
        "ez_drawing_pdf"
      ],
      "review_status": "review_required"
    },
    {
      "slot_id": "slot.O4",
      "value": "2.00",
      "source_channels": [
        "ez_drawing_pdf"
      ],
      "review_status": "review_required"
    },
    {
      "slot_id": "slot.O6",
      "value": "2.00",
      "source_channels": [
        "ez_drawing_pdf"
      ],
      "review_status": "review_required"
    },
    {
      "slot_id": "slot.O8",
      "value": "2.00",
      "source_channels": [
        "ez_drawing_pdf"
      ],
      "review_status": "review_required"
    },
    {
      "slot_id": "slot.OAL",
      "value": "65.25",
      "source_channels": [
        "ez_drawing_pdf"
      ],
      "review_status": "review_required"
    },
    {
      "slot_id": "slot.R2",
      "value": "2.19",
      "source_channels": [
        "ez_drawing_pdf"
      ],
      "review_status": "review_required"
    },
    {
      "slot_id": "slot.R4",
      "value": "4.31",
      "source_channels": [
        "ez_drawing_pdf"
      ],
      "review_status": "review_required"
    },
    {
      "slot_id": "slot.R6",
      "value": "6.44",
      "source_channels": [
        "ez_drawing_pdf"
      ],
      "review_status": "review_required"
    },
    {
      "slot_id": "slot.R8",
      "value": "8.31",
      "source_channels": [
        "ez_drawing_pdf"
      ],
      "review_status": "review_required"
    },
    {
      "slot_id": "slot.RB",
      "value": "1.75",
      "source_channels": [
        "ez_drawing_pdf"
      ],
      "review_status": "review_required"
    },
    {
      "slot_id": "slot.RF",
      "value": "1.50",
      "source_channels": [
        "ez_drawing_pdf"
      ],
      "review_status": "review_required"
    },
    {
      "slot_id": "slot.ROWS",
      "value": "1.00",
      "source_channels": [
        "ez_drawing_pdf"
      ],
      "review_status": "review_required"
    },
    {
      "slot_id": "slot.S1",
      "value": "0.94",
      "source_channels": [
        "ez_drawing_pdf"
      ],
      "review_status": "review_required"
    },
    {
      "slot_id": "slot.SL2",
      "value": "8.00",
      "source_channels": [
        "ez_drawing_pdf"
      ],
      "review_status": "review_required"
    },
    {
      "slot_id": "slot.SUPPLY_CONN_SIZE",
      "value": "0.625\" OD Header",
      "source_channels": [
        "ez_drawing_pdf"
      ],
      "review_status": "review_required"
    },
    {
      "slot_id": "slot.SUPPLY_CONN_SIZE_2",
      "value": "0.625\" SWT-Copper",
      "source_channels": [
        "ez_drawing_pdf"
      ],
      "review_status": "review_required"
    },
    {
      "slot_id": "slot.TAG",
      "value": "RHHGRC-1",
      "source_channels": [
        "ez_drawing_pdf"
      ],
      "review_status": "review_required"
    },
    {
      "slot_id": "slot.TF",
      "value": "0.63",
      "source_channels": [
        "ez_drawing_pdf"
      ],
      "review_status": "review_required"
    },
    {
      "slot_id": "slot.TUBE_MATERIAL",
      "value": "0.375 x 0.016",
      "source_channels": [
        "ez_drawing_pdf"
      ],
      "review_status": "review_required"
    },
    {
      "slot_id": "slot.TUBE_MATERIAL_2",
      "value": "Copper Smooth",
      "source_channels": [
        "ez_drawing_pdf"
      ],
      "review_status": "review_required"
    }
  ],
  "observed_candidates": []
}