{
  "schema_version": "template-first.1",
  "template_id": "coilmaster_vplus_dx_rh_header2",
  "source_case_id": "VPLUS-2619-CONGRESS",
  "supplier": "coilmaster",
  "coil_category": "DX",
  "coil_hand": "RH",
  "header_type": "Header 2",
  "source_folder": "Case/feed/vplus_dx_rh_header2",
  "intake_status": "seeded_review_required",
  "review_status": "review_required",
  "release_status": "review_aid_only",
  "export_allowed": false,
  "production_approved": false,
  "pdf_export_enabled": false,
  "source_files": [
    {
      "role": "ez_drawing_pdf",
      "filename": "2619_Congress.pdf",
      "filename_policy": "not_committed",
      "page_count": 3,
      "committed_copy": false,
      "notes": "Vectorised to a slotted review template; raw PDF not copied."
    }
  ],
  "slot_evidence": [
    {
      "slot_id": "slot.BF",
      "value": "0.88",
      "source_channels": [
        "ez_drawing_pdf"
      ],
      "review_status": "review_required"
    },
    {
      "slot_id": "slot.CASING_MATERIAL",
      "value": "16 Ga.",
      "source_channels": [
        "ez_drawing_pdf"
      ],
      "review_status": "review_required"
    },
    {
      "slot_id": "slot.CASING_MATERIAL_2",
      "value": "Galvanized Steel",
      "source_channels": [
        "ez_drawing_pdf"
      ],
      "review_status": "review_required"
    },
    {
      "slot_id": "slot.CD",
      "value": "5.50",
      "source_channels": [
        "ez_drawing_pdf"
      ],
      "review_status": "review_required"
    },
    {
      "slot_id": "slot.CH",
      "value": "21.75",
      "source_channels": [
        "ez_drawing_pdf"
      ],
      "review_status": "review_required"
    },
    {
      "slot_id": "slot.CIRCUITING",
      "value": "10 Passes per Feed",
      "source_channels": [
        "ez_drawing_pdf"
      ],
      "review_status": "review_required"
    },
    {
      "slot_id": "slot.CIRCUITING_2",
      "value": "C1: 4 Feed C2: 4 Feed",
      "source_channels": [
        "ez_drawing_pdf"
      ],
      "review_status": "review_required"
    },
    {
      "slot_id": "slot.CIRCUITING_3",
      "value": "0 Dropped Tubes",
      "source_channels": [
        "ez_drawing_pdf"
      ],
      "review_status": "review_required"
    },
    {
      "slot_id": "slot.CL",
      "value": "50.00",
      "source_channels": [
        "ez_drawing_pdf"
      ],
      "review_status": "review_required"
    },
    {
      "slot_id": "slot.COIL_TUBE_FACE",
      "value": "Tube Face = 20",
      "source_channels": [
        "ez_drawing_pdf"
      ],
      "review_status": "review_required"
    },
    {
      "slot_id": "slot.DISTRIBUTORS",
      "value": "(2)501-4-3/16-3(0 ASC)",
      "source_channels": [
        "ez_drawing_pdf"
      ],
      "review_status": "review_required"
    },
    {
      "slot_id": "slot.DISTRIBUTORS_2",
      "value": "OD:5/8",
      "source_channels": [
        "ez_drawing_pdf"
      ],
      "review_status": "review_required"
    },
    {
      "slot_id": "slot.DRY_WEIGHT",
      "value": "74.8 Lbs. Per Coil",
      "source_channels": [
        "ez_drawing_pdf"
      ],
      "review_status": "review_required"
    },
    {
      "slot_id": "slot.FASTENER_TYPE",
      "value": "Rivets",
      "source_channels": [
        "ez_drawing_pdf"
      ],
      "review_status": "review_required"
    },
    {
      "slot_id": "slot.FH",
      "value": "20",
      "source_channels": [
        "ez_drawing_pdf"
      ],
      "review_status": "review_required"
    },
    {
      "slot_id": "slot.FIN_MATERIAL",
      "value": "12 Fins Per Inch",
      "source_channels": [
        "ez_drawing_pdf"
      ],
      "review_status": "review_required"
    },
    {
      "slot_id": "slot.FIN_MATERIAL_2",
      "value": "0.0075 Aluminum",
      "source_channels": [
        "ez_drawing_pdf"
      ],
      "review_status": "review_required"
    },
    {
      "slot_id": "slot.FIN_MATERIAL_3",
      "value": "Sine Wave",
      "source_channels": [
        "ez_drawing_pdf"
      ],
      "review_status": "review_required"
    },
    {
      "slot_id": "slot.FL",
      "value": "47",
      "source_channels": [
        "ez_drawing_pdf"
      ],
      "review_status": "review_required"
    },
    {
      "slot_id": "slot.HD2",
      "value": "3.50",
      "source_channels": [
        "ez_drawing_pdf"
      ],
      "review_status": "review_required"
    },
    {
      "slot_id": "slot.HDx1",
      "value": "4.50",
      "source_channels": [
        "ez_drawing_pdf"
      ],
      "review_status": "review_required"
    },
    {
      "slot_id": "slot.HEADER_MATERIAL",
      "value": "Type L Copper",
      "source_channels": [
        "ez_drawing_pdf"
      ],
      "review_status": "review_required"
    },
    {
      "slot_id": "slot.HF",
      "value": "1.50",
      "source_channels": [
        "ez_drawing_pdf"
      ],
      "review_status": "review_required"
    },
    {
      "slot_id": "slot.I1",
      "value": "12.00",
      "source_channels": [
        "ez_drawing_pdf"
      ],
      "review_status": "review_required"
    },
    {
      "slot_id": "slot.I3",
      "value": "12.00",
      "source_channels": [
        "ez_drawing_pdf"
      ],
      "review_status": "review_required"
    },
    {
      "slot_id": "slot.MODEL_NUMBER",
      "value": "DX-F-S-04-12-20.00x47.00-R",
      "source_channels": [
        "ez_drawing_pdf"
      ],
      "review_status": "review_required"
    },
    {
      "slot_id": "slot.O2",
      "value": "2.00",
      "source_channels": [
        "ez_drawing_pdf"
      ],
      "review_status": "review_required"
    },
    {
      "slot_id": "slot.O4",
      "value": "2.00",
      "source_channels": [
        "ez_drawing_pdf"
      ],
      "review_status": "review_required"
    },
    {
      "slot_id": "slot.OAL",
      "value": "52.25",
      "source_channels": [
        "ez_drawing_pdf"
      ],
      "review_status": "review_required"
    },
    {
      "slot_id": "slot.R2",
      "value": "1.13",
      "source_channels": [
        "ez_drawing_pdf"
      ],
      "review_status": "review_required"
    },
    {
      "slot_id": "slot.R4",
      "value": "3.75",
      "source_channels": [
        "ez_drawing_pdf"
      ],
      "review_status": "review_required"
    },
    {
      "slot_id": "slot.RB",
      "value": "1.75",
      "source_channels": [
        "ez_drawing_pdf"
      ],
      "review_status": "review_required"
    },
    {
      "slot_id": "slot.RETURN_CONN_SIZE",
      "value": "1.125\" OD Header",
      "source_channels": [
        "ez_drawing_pdf"
      ],
      "review_status": "review_required"
    },
    {
      "slot_id": "slot.RETURN_CONN_SIZE_2",
      "value": "1.125\" SWT-Copper",
      "source_channels": [
        "ez_drawing_pdf"
      ],
      "review_status": "review_required"
    },
    {
      "slot_id": "slot.RF",
      "value": "1.50",
      "source_channels": [
        "ez_drawing_pdf"
      ],
      "review_status": "review_required"
    },
    {
      "slot_id": "slot.ROWS",
      "value": "4.00",
      "source_channels": [
        "ez_drawing_pdf"
      ],
      "review_status": "review_required"
    },
    {
      "slot_id": "slot.S1",
      "value": "1.88",
      "source_channels": [
        "ez_drawing_pdf"
      ],
      "review_status": "review_required"
    },
    {
      "slot_id": "slot.S3",
      "value": "3.63",
      "source_channels": [
        "ez_drawing_pdf"
      ],
      "review_status": "review_required"
    },
    {
      "slot_id": "slot.SL2",
      "value": "10.00",
      "source_channels": [
        "ez_drawing_pdf"
      ],
      "review_status": "review_required"
    },
    {
      "slot_id": "slot.TAG",
      "value": "CDXC-1",
      "source_channels": [
        "ez_drawing_pdf"
      ],
      "review_status": "review_required"
    },
    {
      "slot_id": "slot.TF",
      "value": "0.88",
      "source_channels": [
        "ez_drawing_pdf"
      ],
      "review_status": "review_required"
    },
    {
      "slot_id": "slot.TUBE_MATERIAL",
      "value": "0.375 x 0.016",
      "source_channels": [
        "ez_drawing_pdf"
      ],
      "review_status": "review_required"
    },
    {
      "slot_id": "slot.TUBE_MATERIAL_2",
      "value": "Copper Smooth",
      "source_channels": [
        "ez_drawing_pdf"
      ],
      "review_status": "review_required"
    }
  ],
  "observed_candidates": []
}