{
  "schema_version": "template-first.1",
  "template_id": "coilmaster_hgrh_rh_header1",
  "source_case_id": "EZC-0012",
  "supplier": "coilmaster",
  "coil_category": "HGRH",
  "coil_hand": "RH",
  "header_type": "Header 1",
  "source_folder": "Case/#2/EZC-0012 - HG_1_RH",
  "intake_status": "seeded_review_required",
  "review_status": "review_required",
  "release_status": "review_aid_only",
  "export_allowed": false,
  "production_approved": false,
  "pdf_export_enabled": false,
  "source_files": [
    {
      "role": "ez_drawing_pdf",
      "filename": "RHHGRC-2.pdf",
      "filename_policy": "not_committed",
      "page_count": 2,
      "committed_copy": false,
      "notes": "Vectorised to a slotted review template; raw PDF not copied."
    }
  ],
  "slot_evidence": [
    {
      "slot_id": "slot.BF",
      "value": "0.63",
      "source_channels": [
        "ez_drawing_pdf"
      ],
      "review_status": "review_required"
    },
    {
      "slot_id": "slot.CASING_MATERIAL",
      "value": "16 Ga.",
      "source_channels": [
        "ez_drawing_pdf"
      ],
      "review_status": "review_required"
    },
    {
      "slot_id": "slot.CD",
      "value": "3.75",
      "source_channels": [
        "ez_drawing_pdf"
      ],
      "review_status": "review_required"
    },
    {
      "slot_id": "slot.CH",
      "value": "27.25",
      "source_channels": [
        "ez_drawing_pdf"
      ],
      "review_status": "review_required"
    },
    {
      "slot_id": "slot.CIRCUITING",
      "value": "3 Feed / 16 Pass",
      "source_channels": [
        "ez_drawing_pdf"
      ],
      "review_status": "review_required"
    },
    {
      "slot_id": "slot.CL",
      "value": "37.00",
      "source_channels": [
        "ez_drawing_pdf"
      ],
      "review_status": "review_required"
    },
    {
      "slot_id": "slot.COIL_TUBE_FACE",
      "value": "Tube Face = 26",
      "source_channels": [
        "ez_drawing_pdf"
      ],
      "review_status": "review_required"
    },
    {
      "slot_id": "slot.FH",
      "value": "26",
      "source_channels": [
        "ez_drawing_pdf"
      ],
      "review_status": "review_required"
    },
    {
      "slot_id": "slot.FIN_MATERIAL",
      "value": "8 Fins Per Inch",
      "source_channels": [
        "ez_drawing_pdf"
      ],
      "review_status": "review_required"
    },
    {
      "slot_id": "slot.FL",
      "value": "34",
      "source_channels": [
        "ez_drawing_pdf"
      ],
      "review_status": "review_required"
    },
    {
      "slot_id": "slot.HD2",
      "value": "3.50",
      "source_channels": [
        "ez_drawing_pdf"
      ],
      "review_status": "review_required"
    },
    {
      "slot_id": "slot.HEADER_MATERIAL",
      "value": "Type L Copper",
      "source_channels": [
        "ez_drawing_pdf"
      ],
      "review_status": "review_required"
    },
    {
      "slot_id": "slot.HF",
      "value": "1.50",
      "source_channels": [
        "ez_drawing_pdf"
      ],
      "review_status": "review_required"
    },
    {
      "slot_id": "slot.I1",
      "value": "2.00",
      "source_channels": [
        "ez_drawing_pdf"
      ],
      "review_status": "review_required"
    },
    {
      "slot_id": "slot.MODEL_NUMBER",
      "value": "CD-F-F-02-08-26.00x34.00-R",
      "source_channels": [
        "ez_drawing_pdf"
      ],
      "review_status": "review_required"
    },
    {
      "slot_id": "slot.O2",
      "value": "2.00",
      "source_channels": [
        "ez_drawing_pdf"
      ],
      "review_status": "review_required"
    },
    {
      "slot_id": "slot.OAL",
      "value": "39.25",
      "source_channels": [
        "ez_drawing_pdf"
      ],
      "review_status": "review_required"
    },
    {
      "slot_id": "slot.R2",
      "value": "1.88",
      "source_channels": [
        "ez_drawing_pdf"
      ],
      "review_status": "review_required"
    },
    {
      "slot_id": "slot.RB",
      "value": "1.75",
      "source_channels": [
        "ez_drawing_pdf"
      ],
      "review_status": "review_required"
    },
    {
      "slot_id": "slot.RETURN_CONN_SIZE",
      "value": "0.625\" OD Header",
      "source_channels": [
        "ez_drawing_pdf"
      ],
      "review_status": "review_required"
    },
    {
      "slot_id": "slot.RF",
      "value": "1.50",
      "source_channels": [
        "ez_drawing_pdf"
      ],
      "review_status": "review_required"
    },
    {
      "slot_id": "slot.ROWS",
      "value": "2.00",
      "source_channels": [
        "ez_drawing_pdf"
      ],
      "review_status": "review_required"
    },
    {
      "slot_id": "slot.S1",
      "value": "0.63",
      "source_channels": [
        "ez_drawing_pdf"
      ],
      "review_status": "review_required"
    },
    {
      "slot_id": "slot.SL2",
      "value": "8.00",
      "source_channels": [
        "ez_drawing_pdf"
      ],
      "review_status": "review_required"
    },
    {
      "slot_id": "slot.TAG",
      "value": "RHHGRC-2",
      "source_channels": [
        "ez_drawing_pdf"
      ],
      "review_status": "review_required"
    },
    {
      "slot_id": "slot.TF",
      "value": "0.63",
      "source_channels": [
        "ez_drawing_pdf"
      ],
      "review_status": "review_required"
    },
    {
      "slot_id": "slot.TUBE_MATERIAL",
      "value": "0.375 x 0.016",
      "source_channels": [
        "ez_drawing_pdf"
      ],
      "review_status": "review_required"
    }
  ],
  "observed_candidates": []
}